[
 {
  "agenda_items": [
   {
    "item": "6",
    "meeting_id": "city-council-2026-03-10"
   }
  ],
  "description": "The City Auditor's audit of non-competitive City contracts, its 13 recommendations, City management's responses, and the Council's direction that the City Manager report back on them.",
  "id": "contracts-audit-2026",
  "kind": "audit",
  "last_reviewed": "2026-10-28",
  "opened": "2026-02-19",
  "qualifications": [
   {
    "locator": "PDF p. 30",
    "quote": "We have not yet confirmed to what extent any recommendations may have been implemented prior to the audit release date.",
    "source_id": "src-contracts-audit-2026"
   }
  ],
  "title": "City Contracts audit (City Auditor, February 2026)"
 },
 {
  "agenda_items": [
   {
    "item": "28",
    "meeting_id": "city-council-2024-01-16"
   }
  ],
  "description": "City Council, 2024-01-16, Item 28: Consideration of Options for Berkeley High School Staff Parking. Moved to the Consent Calendar and adopted as amended to apply only to RPP Area C. The same action referred options to increase walking, biking, carpooling and transit use by Berkeley High employees and students to the 2x2 Committee and the City Manager, and asked BUSD to consider formally withdrawing from planning a garage on its Milvia Street property. On 2024-06-04 the Council re-approved the findings and set how the number of permits is calculated (Resolution No. 71,358-N.S.).",
  "id": "berkeley-high-school-staff-parking-permits-2024",
  "kind": "council_referral",
  "last_reviewed": "2026-10-30",
  "opened": "2024-01-16",
  "qualifications": [],
  "title": "Berkeley High School staff parking permits"
 },
 {
  "agenda_items": [
   {
    "item": "29",
    "meeting_id": "city-council-2024-01-16"
   }
  ],
  "description": "City Council, 2024-01-16, Item 29: Referral: Neighborhood-Scale Commercial.",
  "id": "neighborhood-scale-commercial-2024",
  "kind": "council_referral",
  "last_reviewed": "2026-10-30",
  "opened": "2024-01-16",
  "qualifications": [],
  "title": "Neighborhood-scale commercial uses in residential zones"
 },
 {
  "agenda_items": [
   {
    "item": "12",
    "meeting_id": "city-council-2024-02-13"
   }
  ],
  "description": "City Council, 2024-02-13, Item 12: Recommendation on Public Safety/Crime Prevention for Women.",
  "id": "crime-prevention-women-2024",
  "kind": "council_referral",
  "last_reviewed": "2026-10-30",
  "opened": "2024-02-13",
  "qualifications": [],
  "title": "Crime prevention programs addressing crime against women"
 },
 {
  "agenda_items": [
   {
    "item": "13",
    "meeting_id": "city-council-2024-02-13"
   }
  ],
  "description": "City Council, 2024-02-13, Item 13: RFP for Development of West Berkeley Service Center.",
  "id": "west-berkeley-service-center-2024",
  "kind": "council_referral",
  "last_reviewed": "2026-10-30",
  "opened": "2024-02-13",
  "qualifications": [],
  "title": "West Berkeley Service Center redevelopment"
 },
 {
  "agenda_items": [
   {
    "item": "16",
    "meeting_id": "city-council-2024-02-27"
   }
  ],
  "description": "City Council, 2024-02-27, Item 16: Zoning Amendments for Berkeley Business; Amending Berkeley Municipal Code Title 23. The Council adopted the ordinance on first reading and referred to the City Manager a request to develop regulations and performance standards to mitigate noise impacts for Group Class Instruction uses.",
  "id": "group-class-instruction-noise-2024",
  "kind": "council_referral",
  "last_reviewed": "2026-10-30",
  "opened": "2024-02-27",
  "qualifications": [],
  "title": "Noise standards for Group Class Instruction uses"
 },
 {
  "agenda_items": [
   {
    "item": "19",
    "meeting_id": "city-council-2024-03-26"
   }
  ],
  "description": "City Council, 2024-03-26, Item 19: Response to Council Referral: Long Term Care Facility Oversight.",
  "id": "long-term-care-facility-oversight-2024",
  "kind": "council_referral",
  "last_reviewed": "2026-10-30",
  "opened": "2024-03-26",
  "qualifications": [],
  "title": "Long-term care facility oversight"
 },
 {
  "agenda_items": [
   {
    "item": "33b",
    "meeting_id": "city-council-2024-05-07-0"
   }
  ],
  "description": "City Council, 2024-05-07, Item 33b: Companion Report: Achieving Goals of 2018 Berkeley Age-Friendly Action Plan.",
  "id": "age-friendly-action-plan-2024",
  "kind": "council_referral",
  "last_reviewed": "2026-10-30",
  "opened": "2024-05-07",
  "qualifications": [],
  "title": "Age-Friendly Action Plan (2018) implementation"
 },
 {
  "agenda_items": [
   {
    "item": "43",
    "meeting_id": "city-council-2024-05-07-0"
   }
  ],
  "description": "City Council, 2024-05-07, Item 43: Budget Referral: Vision Zero Rapid Response on Bicycle Boulevards.",
  "id": "bicycle-boulevards-vision-zero-2024",
  "kind": "council_referral",
  "last_reviewed": "2026-10-30",
  "opened": "2024-05-07",
  "qualifications": [],
  "title": "Vision Zero rapid response on bicycle boulevards"
 },
 {
  "agenda_items": [
   {
    "item": "51",
    "meeting_id": "city-council-2024-05-07-0"
   }
  ],
  "description": "City Council, 2024-05-07, Item 51: Budget Referral for Development of Voluntary Design Guidelines.",
  "id": "voluntary-design-guidelines-2024",
  "kind": "council_referral",
  "last_reviewed": "2026-10-30",
  "opened": "2024-05-07",
  "qualifications": [],
  "title": "Voluntary Design Guidelines"
 },
 {
  "agenda_items": [
   {
    "item": "26",
    "meeting_id": "city-council-2024-05-14"
   }
  ],
  "description": "City Council, 2024-05-14, Item 26: 2024 City Council Referral Prioritization Process Using Re-Weighted Range Voting (RRV).",
  "id": "referral-prioritization-rrv-2024",
  "kind": "council_referral",
  "last_reviewed": "2026-10-30",
  "opened": "2024-05-14",
  "qualifications": [],
  "title": "Council referral prioritization (re-weighted range voting)"
 },
 {
  "agenda_items": [
   {
    "item": "14",
    "meeting_id": "city-council-2024-05-21"
   }
  ],
  "description": "City Council, 2024-05-21, Item 14: Develop a pilot program for 5-10 Seriously Mentally Ill (SMI) persons who have required frequent interventions.",
  "id": "smi-care-team-pilot-2024",
  "kind": "council_referral",
  "last_reviewed": "2026-10-30",
  "opened": "2024-05-21",
  "qualifications": [],
  "title": "Care-team pilot for frequently served seriously mentally ill residents"
 },
 {
  "agenda_items": [
   {
    "item": "33",
    "meeting_id": "city-council-2024-06-25-0"
   }
  ],
  "description": "City Council, 2024-06-25, Item 33: Audit Recommendation Status - Berkeley Police: Improvements Needed to Manage Overtime and Security Work for Outside Entities.",
  "id": "berkeley-police-overtime-audit-2024",
  "kind": "council_referral",
  "last_reviewed": "2026-10-30",
  "opened": "2024-06-25",
  "qualifications": [],
  "title": "Berkeley Police overtime and outside security work audit"
 },
 {
  "agenda_items": [
   {
    "item": "53",
    "meeting_id": "city-council-2024-06-25-0"
   }
  ],
  "description": "City Council, 2024-06-25, Item 53: Fiscal Years 2025 & 2026 Biennial Budget Adoption.",
  "id": "community-agency-annual-financial-reports-2024",
  "kind": "budget_action",
  "last_reviewed": "2026-10-30",
  "opened": "2024-06-25",
  "qualifications": [],
  "title": "Annual financial reports from community agencies funded outside the RFP process"
 },
 {
  "agenda_items": [
   {
    "item": "59",
    "meeting_id": "city-council-2024-06-25-0"
   }
  ],
  "description": "City Council, 2024-06-25, Item 59: Referral for Development of Request for Proposal (RFP) to Support Berkeley-Based Non-Profit Food Assistance Providers Serving Food Insecure Households.",
  "id": "food-assistance-provider-rfp-2024",
  "kind": "council_referral",
  "last_reviewed": "2026-10-30",
  "opened": "2024-06-25",
  "qualifications": [],
  "title": "RFP for Berkeley non-profit food assistance providers"
 },
 {
  "agenda_items": [
   {
    "item": "23",
    "meeting_id": "city-council-2024-07-09"
   }
  ],
  "description": "City Council, 2024-07-09, Item 23: Amendments to Berkeley Municipal Code 23C.22: Short Term Rentals.",
  "id": "short-term-rental-amendments-2024",
  "kind": "council_referral",
  "last_reviewed": "2026-10-30",
  "opened": "2024-07-09",
  "qualifications": [],
  "title": "Short-term rental ordinance amendments (BMC 23C.22)"
 },
 {
  "agenda_items": [
   {
    "item": "14",
    "meeting_id": "city-council-2024-07-30"
   }
  ],
  "description": "City Council, 2024-07-30, Item 14: Referral to Develop Curb Management Plan.",
  "id": "curb-management-plan-2024",
  "kind": "council_referral",
  "last_reviewed": "2026-10-30",
  "opened": "2024-07-30",
  "qualifications": [],
  "title": "Curb Management Plan"
 },
 {
  "agenda_items": [
   {
    "item": "15",
    "meeting_id": "city-council-2024-07-30"
   }
  ],
  "description": "City Council, 2024-07-30, Item 15: Referral to City Manager: Ashby BART Area Enhanced Infrastructure Finance District (EIFD) Analysis.",
  "id": "ashby-bart-eifd-2024",
  "kind": "council_referral",
  "last_reviewed": "2026-10-30",
  "opened": "2024-07-30",
  "qualifications": [],
  "title": "Ashby BART area Enhanced Infrastructure Financing District"
 },
 {
  "agenda_items": [
   {
    "item": "18",
    "meeting_id": "city-council-2024-07-30"
   }
  ],
  "description": "City Council, 2024-07-30, Item 18: Berkeley Restaurant Inspections: Chronically Understaffed Program Did Not Meet Targets.",
  "id": "restaurant-inspections-audit-2024",
  "kind": "audit",
  "last_reviewed": "2026-10-30",
  "opened": "2024-07-30",
  "qualifications": [],
  "title": "Restaurant inspections audit (City Auditor, 2024)"
 },
 {
  "agenda_items": [
   {
    "item": "1",
    "meeting_id": "city-council-2024-09-30-0"
   }
  ],